metabolite_solar,mz_solar,rt_solar,cpd,aa_cho_lipid,pathways_solar,main_sp_pthw_solar,main_sp_pthw_categorized_solar,exposure,p_value_solar,t_score_solar,beta_solar,conf_low_solar,conf_high_solar,mode_solar,super_pathway_solar,q_value_solar,cpdnum_solar,cpd_sig_solar,exposure2,metabolite_chs,mz_chs,rt_chs,pathways_chs,main_sp_pthw_chs,main_sp_pthw_categorized_chs,p_value_chs,t_score_chs,beta_chs,conf_low_chs,conf_high_chs,mode_chs,super_pathway_chs,q_value_chs,cpdnum_chs,cpd_sig_chs,sig
433.330990250479_22.4405266826437,433.330990250479,22.4405266826437,C04722; C17335; CE2202; CE2205; dlnlcgcrn,Lipid metab.,Bile acid biosynthesis; Carnitine shuttle,Lipid metabolism; Lipid metabolism; Metabolism of cofactors and vitamins,Lipid metabolism; Lipid metabolism; Metabolism of cofactors and vitamins,hexachlorobenzene_impute,0.792990302388856,-0.262674870326719,-0.0161026991610457,-0.136764542871042,0.10455914454895,positive,Multiple/other,1,296,,HCB,433.331131699374_261.7777474,433.331131699374,261.7777474,Bile acid biosynthesis; Carnitine shuttle,Lipid metabolism,Lipid metabolism,0.655167361221368,0.447643234742905,0.0653320524763726,-0.223448426623948,0.354112531576693,positive,Lipid metabolism,1,321,,Not-sig
186.112486734294_42.6109933361007,186.112486734294,42.6109933361007,C05475; C05478; C05487; C05587; C07453,Amino Acid & Lipid metab.,C21-steroid hormone biosynthesis and metabolism; Tyrosine metabolism,Lipid metabolism; Amino acid metabolism,Lipid metabolism; Amino acid metabolism,hexachlorobenzene_impute,0.815276197048333,0.233840376843726,0.0145074169061501,-0.107605159342681,0.136619993154982,positive,Multiple/other,1,299,,HCB,186.112500250362_42.08583355,186.112500250362,42.08583355,C21-steroid hormone biosynthesis and metabolism; Tyrosine metabolism,Lipid metabolism; Amino acid metabolism,Lipid metabolism; Amino acid metabolism,0.134911529115173,1.50451821545452,0.206673519810895,-0.0651336706122912,0.478480710234082,positive,Multiple/other,1,56,,Not-sig
186.112486734294_42.6109933361007,186.112486734294,42.6109933361007,C05475; C05478; C05487; C05587; C07453,Amino Acid & Lipid metab.,C21-steroid hormone biosynthesis and metabolism; Tyrosine metabolism,Lipid metabolism; Amino acid metabolism,Lipid metabolism; Amino acid metabolism,hexachlorobenzene_impute,0.815276197048333,0.233840376843726,0.0145074169061501,-0.107605159342681,0.136619993154982,positive,Multiple/other,1,299,,HCB,186.113325914895_198.844808722486,186.113325914895,198.844808722486,C21-steroid hormone biosynthesis and metabolism; Tyrosine metabolism,Lipid metabolism; Amino acid metabolism,Lipid metabolism; Amino acid metabolism,0.6670210233944,0.431237592458689,0.0652405487258351,-0.234106201763225,0.364587299214895,negative,Multiple/other,1,177,,Not-sig
249.061086687209_36.5855525298009,249.061086687209,36.5855525298009,C01762; CE5541,Amino Acid metab.,Purine metabolism; Tyrosine metabolism,Nucleotide metabolism; Amino acid metabolism,Nucleotide metabolism; Amino acid metabolism,hexachlorobenzene_impute,0.870579893684839,-0.163068208280039,-0.00968209144380582,-0.126548496529765,0.107184313642153,positive,Multiple/other,1,311,,HCB,249.061518421442_190.68492820553,249.061518421442,190.68492820553,Purine metabolism; Tyrosine metabolism,Nucleotide metabolism; Amino acid metabolism,Nucleotide metabolism; Amino acid metabolism,0.0343921271060073,-2.13830246863532,-0.313924464722143,-0.604413390637788,-0.0234355388064977,negative,Multiple/other,1,27,,Sig. CHS only
249.061086687209_36.5855525298009,249.061086687209,36.5855525298009,C01762; CE5541,Amino Acid metab.,Purine metabolism; Tyrosine metabolism,Nucleotide metabolism; Amino acid metabolism,Nucleotide metabolism; Amino acid metabolism,hexachlorobenzene_impute,0.870579893684839,-0.163068208280039,-0.00968209144380582,-0.126548496529765,0.107184313642153,positive,Multiple/other,1,311,,HCB,249.061006546454_60.39479769,249.061006546454,60.39479769,Purine metabolism; Tyrosine metabolism,Nucleotide metabolism; Amino acid metabolism; NA,Nucleotide metabolism; Other Combination of pathways,0.945123178797509,0.068967418457248,0.0100610445396032,-0.278589683510674,0.29871177258988,positive,Multiple/other,1,227,,Not-sig
112.039433690647_272.50235333631,112.039433690647,272.50235333631,C00025; C00217; C00847; C00870; C00906; C01879; C02220; C04281; C04282; C05938,Other,"Methionine and cysteine metabolism; Glycine, serine, alanine and threonine metabolism; Arginine and Proline Metabolism; Tryptophan metabolism; Alanine and Aspartate Metabolism; Urea cycle/amino group metabolism; Histidine metabolism; Tyrosine metabolism; Aspartate and asparagine metabolism; Vitamin B6 (pyridoxine) metabolism; Parathio degradation; Pyrimidine metabolism; Arginine and Proline Metabolism; Aspartate and asparagine metabolism; Tryptophan metabolism",NA,NA,hexachlorobenzene_impute,0.877024903131432,-0.154880333761661,-0.0097591663640269,-0.13378331368202,0.114264980953966,positive,Multiple/other,1,313,,HCB,112.039267750594_103.8579082,112.03926775059399,103.8579082,"Tyrosine metabolism; Urea cycle/amino group metabolism; Tryptophan metabolism; Valine, leucine and isoleucine degradation; Glycine, serine, alanine and threonine metabolism; Glutathione Metabolism; Glutamate metabolism; Beta-Alanine metabolism; Arginine and Proline Metabolism; Histidine metabolism; Lysine metabolism; Aspartate and asparagine metabolism; Methionine and cysteine metabolism; Aminosugars metabolism; Alanine and Aspartate Metabolism; Vitamin B6 (pyridoxine) metabolism; Xenobiotics metabolism; Pyrimidine metabolism; Glutathione Metabolism; Arginine and Proline Metabolism; Aspartate and asparagine metabolism; Tryptophan metabolism",NA,NA,0.918871851036263,0.102056098913302,0.014764322450947,-0.271487403436718,0.301016048338612,positive,Multiple/other,1,220,,Not-sig
100.075740157339_31.7188017810714,100.075740157339,31.7188017810714,C00183; C00431; C00719; C02946; C03239; C04076,Amino Acid & CHO metab.,"Glycine, serine, alanine and threonine metabolism; Arginine and Proline Metabolism; Urea cycle/amino group metabolism; Aspartate and asparagine metabolism",Amino acid metabolism; Carbohydrate metabolism; Amino acid metabolism,Other Combination of pathways; Amino acid metabolism,hexachlorobenzene_impute,0.891733020812788,0.136232886184409,0.00824394634615526,-0.110864621667036,0.127352514359347,positive,Multiple/other,1,318,,HCB,118.086186883262_87.65033242,118.086186883262,87.65033242,"Valine, leucine and isoleucine degradation; Glycine, serine, alanine and threonine metabolism; Urea cycle/amino group metabolism; Arginine and Proline Metabolism; Lysine metabolism; Aspartate and asparagine metabolism",Amino acid metabolism; Carbohydrate metabolism; Amino acid metabolism,Amino acid metabolism; Carbohydrate metabolism; Amino acid metabolism,0.264748143999175,1.12014783754698,0.158086923352351,-0.121163704549454,0.437337551254155,positive,Multiple/other,1,89,,Not-sig
100.075740157339_31.7188017810714,100.075740157339,31.7188017810714,C00183; C00431; C00719; C02946; C03239; C04076,Amino Acid & CHO metab.,"Glycine, serine, alanine and threonine metabolism; Arginine and Proline Metabolism; Urea cycle/amino group metabolism; Aspartate and asparagine metabolism",Amino acid metabolism; Carbohydrate metabolism; Amino acid metabolism,Other Combination of pathways; Amino acid metabolism,hexachlorobenzene_impute,0.891733020812788,0.136232886184409,0.00824394634615526,-0.110864621667036,0.127352514359347,positive,Multiple/other,1,318,,HCB,100.075635120414_46.51158097,100.075635120414,46.51158097,"Valine, leucine and isoleucine degradation; Glycine, serine, alanine and threonine metabolism; Urea cycle/amino group metabolism; Arginine and Proline Metabolism; Lysine metabolism; Aspartate and asparagine metabolism",Amino acid metabolism; Carbohydrate metabolism; Amino acid metabolism,Amino acid metabolism; Carbohydrate metabolism; Amino acid metabolism,0.866749460106621,0.168126070696854,0.0249194935441319,-0.268357303231791,0.318196290320055,positive,Multiple/other,1,210,,Not-sig
431.31532312803_22.5661252392373,431.31532312803,22.5661252392373,arachdcrn; C17337; CE2203; CE2206; eicostetcrn,Lipid metab.,Carnitine shuttle; Bile acid biosynthesis,Lipid metabolism; Lipid metabolism; Metabolism of cofactors and vitamins,Lipid metabolism; Lipid metabolism; Metabolism of cofactors and vitamins,hexachlorobenzene_impute,0.894894546773501,-0.132231018119911,-0.00781750732013792,-0.12418314641015,0.108548131769874,positive,Multiple/other,1,319,,HCB,431.315360255116_36.34598075,431.315360255116,36.34598075,Carnitine shuttle; Bile acid biosynthesis,Lipid metabolism,Lipid metabolism,0.664880017816161,0.434192016998845,0.0606171764907138,-0.215623370147363,0.336857723128791,positive,Lipid metabolism,1,322,,Not-sig
196.096810323559_203.057543279885,196.096810323559,203.057543279885,C00486; C16586; CE1918; CE2173; CE5629,Amino Acid & Lipid metab.,C21-steroid hormone biosynthesis and metabolism; Tyrosine metabolism; Tryptophan metabolism; Tyrosine metabolism,Lipid metabolism; Metabolism of cofactors and vitamins; Amino acid metabolism; Xenobiotics biodegradation and metabolism; Amino acid metabolism,Lipid metabolism; Metabolism of cofactors and vitamins; Amino acid metabolism; Xenobiotics biodegradation and metabolism; Amino acid metabolism,hexachlorobenzene_impute,0.906350366719568,0.117747515403567,0.00722170373285085,-0.113497877483116,0.127941284948818,positive,Multiple/other,1,320,,HCB,196.096825646129_42.391167,196.096825646129,42.391167,C21-steroid hormone biosynthesis and metabolism; Tyrosine metabolism; Tyrosine metabolism; Tryptophan metabolism,Lipid metabolism; Metabolism of cofactors and vitamins; Amino acid metabolism; Xenobiotics biodegradation and metabolism; Amino acid metabolism,Lipid metabolism; Metabolism of cofactors and vitamins; Other Combination of pathways; Amino acid metabolism,0.641771951550307,0.466330017383607,0.0670056985564173,-0.217304162624018,0.351315559736852,positive,Multiple/other,1,171,,Not-sig
127.05027380537_261.182919786149,127.05027380537,261.182919786149,C00178; C01736; C02835; C05512; C15586,Amino Acid metab.,Histidine metabolism; Purine metabolism,Amino acid metabolism; Nucleotide metabolism; Nucleotide metabolism,Amino acid metabolism; Nucleotide metabolism; Nucleotide metabolism,hexachlorobenzene_impute,0.909624022753151,0.113613340314605,0.00709300685289906,-0.115789724253322,0.12997573795912,positive,Multiple/other,1,321,,HCB,127.050244003557_18.23611487,127.050244003557,18.23611487,Histidine metabolism; Purine metabolism,Amino acid metabolism; Nucleotide metabolism; Nucleotide metabolism,Amino acid metabolism; Nucleotide metabolism; Nucleotide metabolism,0.90814950032378,-0.115601543899512,-0.0172531985292663,-0.31256414200593,0.278057744947397,positive,Multiple/other,1,219,,Not-sig
189.123277948662_47.1220757851191,189.123277948662,47.1220757851191,C02727; C03415,Amino Acid & CHO metab.,Butanoate metabolism; Aspartate and asparagine metabolism,Carbohydrate metabolism; Amino acid metabolism,Carbohydrate metabolism; Amino acid metabolism,hexachlorobenzene_impute,0.920106354484514,0.100388348697866,0.00590065708005986,-0.10979228620306,0.12159360036318,positive,Multiple/other,1,322,,HCB,189.123360163293_87.42165556,189.123360163293,87.42165556,Butanoate metabolism; Aspartate and asparagine metabolism,Carbohydrate metabolism; Amino acid metabolism,Carbohydrate metabolism; Amino acid metabolism,0.401889715274279,0.841047592979044,0.121042275611371,-0.163724988868778,0.40580954009152,positive,Multiple/other,1,118,,Not-sig
97.0761721720639_72.6176376567768,97.0761721720639,72.6176376567768,C00077; C00515; C00534; C01602; C05827; C05828,Other,"Glycine, serine, alanine and threonine metabolism; Urea cycle/amino group metabolism; Aspartate and asparagine metabolism; Vitamin B6 (pyridoxine) metabolism; Histidine metabolism",NA,NA,hexachlorobenzene_impute,0.926474026452596,-0.0923633428860424,-0.00570028356859834,-0.127175203709721,0.115774636572524,positive,Multiple/other,1,323,,HCB,97.0760268605202_35.54111067,97.0760268605202,35.54111067,"Urea cycle/amino group metabolism; Glycine, serine, alanine and threonine metabolism; Aspartate and asparagine metabolism; Vitamin B6 (pyridoxine) metabolism; Histidine metabolism",NA,NA,0.796540807797783,0.258364212142,0.0387408258734805,-0.257954069363666,0.335435721110627,positive,Multiple/other,1,197,,Not-sig
118.086315590778_53.7073278721895,118.086315590778,53.7073278721895,C00183; C00431; C00719; C02946; C03239; C04076,Amino Acid & CHO metab.,"Glycine, serine, alanine and threonine metabolism; Arginine and Proline Metabolism; Urea cycle/amino group metabolism; Aspartate and asparagine metabolism",Amino acid metabolism; Carbohydrate metabolism; Amino acid metabolism,Other Combination of pathways; Amino acid metabolism,hexachlorobenzene_impute,0.953324568243379,-0.0585837463347064,-0.00363978206627707,-0.125928965326758,0.118649401194204,positive,Multiple/other,1,327,,HCB,118.086186883262_87.65033242,118.086186883262,87.65033242,"Valine, leucine and isoleucine degradation; Glycine, serine, alanine and threonine metabolism; Urea cycle/amino group metabolism; Arginine and Proline Metabolism; Lysine metabolism; Aspartate and asparagine metabolism",Amino acid metabolism; Carbohydrate metabolism; Amino acid metabolism,Amino acid metabolism; Carbohydrate metabolism; Amino acid metabolism,0.264748143999175,1.12014783754698,0.158086923352351,-0.121163704549454,0.437337551254155,positive,Multiple/other,1,89,,Not-sig
118.086315590778_53.7073278721895,118.086315590778,53.7073278721895,C00183; C00431; C00719; C02946; C03239; C04076,Amino Acid & CHO metab.,"Glycine, serine, alanine and threonine metabolism; Arginine and Proline Metabolism; Urea cycle/amino group metabolism; Aspartate and asparagine metabolism",Amino acid metabolism; Carbohydrate metabolism; Amino acid metabolism,Other Combination of pathways; Amino acid metabolism,hexachlorobenzene_impute,0.953324568243379,-0.0585837463347064,-0.00363978206627707,-0.125928965326758,0.118649401194204,positive,Multiple/other,1,327,,HCB,100.075635120414_46.51158097,100.075635120414,46.51158097,"Valine, leucine and isoleucine degradation; Glycine, serine, alanine and threonine metabolism; Urea cycle/amino group metabolism; Arginine and Proline Metabolism; Lysine metabolism; Aspartate and asparagine metabolism",Amino acid metabolism; Carbohydrate metabolism; Amino acid metabolism,Amino acid metabolism; Carbohydrate metabolism; Amino acid metabolism,0.866749460106621,0.168126070696854,0.0249194935441319,-0.268357303231791,0.318196290320055,positive,Multiple/other,1,210,,Not-sig
150.091321223107_190.922906561324,150.091321223107,190.922906561324,C05587; C07453; C16586; C16587; C16595; CE1918; CE2173; CE5629,Amino Acid metab.,Tyrosine metabolism; Drug metabolism - cytochrome P450; Tryptophan metabolism; Tyrosine metabolism,Amino acid metabolism; Amino acid metabolism; Xenobiotics biodegradation and metabolism; Xenobiotics biodegradation and metabolism,Amino acid metabolism; Amino acid metabolism; Xenobiotics biodegradation and metabolism; Xenobiotics biodegradation and metabolism,hexachlorobenzene_impute,0.962981946512758,0.0464525818637932,0.00290777443023571,-0.120300722690229,0.1261162715507,positive,Multiple/other,1,331,,HCB,150.091382024662_38.02149055,150.091382024662,38.02149055,Tyrosine metabolism; Drug metabolism - cytochrome P450; Tyrosine metabolism; Tryptophan metabolism,Amino acid metabolism; Amino acid metabolism; Xenobiotics biodegradation and metabolism; Xenobiotics biodegradation and metabolism,Amino acid metabolism; Other Combination of pathways; Xenobiotics biodegradation and metabolism,0.0924753706140759,1.69516547119769,0.242642102878064,-0.0405803105474305,0.525864516303558,positive,Multiple/other,1,43,,Not-sig
154.069017535776_34.5962599680613,154.069017535776,34.5962599680613,C00440; C05842; C05843; CE5251; CE5252; CE5255; CE5256,Amino Acid metab.,Methionine and cysteine metabolism; Vitamin B3 (nicotinate and nicotinamide) metabolism; Androgen and estrogen biosynthesis and metabolism,Amino acid metabolism; Metabolism of cofactors and vitamins; Steroid hormone metabolism,Amino acid metabolism; Metabolism of cofactors and vitamins; Steroid hormone metabolism,hexachlorobenzene_impute,0.964426082543796,-0.0446391561967303,-0.00270176339278357,-0.12183176306939,0.116428236283823,positive,Multiple/other,1,332,,HCB,154.069146798658_49.02837259,154.069146798658,49.02837259,Methionine and cysteine metabolism; Vitamin B3 (nicotinate and nicotinamide) metabolism; Androgen and estrogen biosynthesis and metabolism,Amino acid metabolism; Metabolism of cofactors and vitamins; Other; Metabolism of cofactors and vitamins; Steroid hormone metabolism,Other Combination of pathways; Metabolism of cofactors and vitamins; Steroid hormone metabolism,0.953984320681695,0.0578172985110293,0.00855169745018909,-0.284111482897016,0.301214877797394,positive,Multiple/other,1,228,,Not-sig
239.23677497351_34.0094663319251,239.23677497351,34.0094663319251,C00249,Lipid metab.,Glycosphingolipid metabolism; Saturated fatty acids beta-oxidation; Fatty Acid Metabolism; De novo fatty acid biosynthesis; Fatty acid activation,Lipid metabolism; Xenobiotics biodegradation and metabolism,Other Combination of pathways,hexachlorobenzene_impute,0.976197274412419,-0.029862834486549,-0.00180820936732882,-0.120989337447621,0.117372918712963,positive,Multiple/other,1,337,,HCB,239.236855393934_34.76943589,239.236855393934,34.76943589,Glycosphingolipid metabolism; Saturated fatty acids beta-oxidation; Fatty Acid Metabolism; De novo fatty acid biosynthesis; Fatty acid activation,Lipid metabolism; Xenobiotics biodegradation and metabolism,Other Combination of pathways,6.69192984160785e-4,-3.48732486600922,-0.483301558109207,-0.757521695737578,-0.209081420480836,positive,Multiple/other,0.3708142997857786,4,,Sig. CHS only
144.101899297218_52.9945402190885,144.101899297218,52.9945402190885,C05548; CE1943,Amino Acid & CHO metab.,Butanoate metabolism; Aspartate and asparagine metabolism,Carbohydrate metabolism; Amino acid metabolism,Carbohydrate metabolism; Amino acid metabolism,hexachlorobenzene_impute,0.980378256763624,0.0246162087638066,0.00153217541625443,-0.120979400862626,0.124043751695135,positive,Multiple/other,1,338,,HCB,144.101933307511_44.39497951,144.101933307511,44.39497951,Butanoate metabolism; Aspartate and asparagine metabolism,Carbohydrate metabolism; Amino acid metabolism,Carbohydrate metabolism; Amino acid metabolism,0.658146200941792,0.4435092324357,0.0661062402094971,-0.228819955072971,0.361032435491965,positive,Multiple/other,1,175,,Not-sig
263.060439733506_77.1642478036912,263.060439733506,77.1642478036912,C00016,"Amino Acid, Lipid, & CHO metab.","Glycine, serine, alanine and threonine metabolism; Arginine and Proline Metabolism; Tryptophan metabolism; Urea cycle/amino group metabolism; Aspartate and asparagine metabolism",Amino acid metabolism; Carbohydrate metabolism; Lipid metabolism; Metabolism of cofactors and vitamins; NA,Other Combination of pathways,hexachlorobenzene_impute,0.992819543426779,-0.00900735996162444,-5.47905363023787e-4,-0.120276486783803,0.119180676057756,positive,Multiple/other,1,339,,HCB,263.060030026189_163.0688729,263.060030026189,163.0688729,"Urea cycle/amino group metabolism; Tryptophan metabolism; Valine, leucine and isoleucine degradation; Glycine, serine, alanine and threonine metabolism; Arginine and Proline Metabolism; Lysine metabolism; Aspartate and asparagine metabolism",Amino acid metabolism; Carbohydrate metabolism; Lipid metabolism; Metabolism of cofactors and vitamins; NA,Other Combination of pathways,0.441973191097275,-0.771261814819653,-0.114042533580612,-0.406618455922072,0.178533388760848,positive,Multiple/other,1,132,,Not-sig
158.076789401611_68.9497767318366,158.076789401611,68.9497767318366,CE2026,Amino Acid metab.,"Glycine, serine, alanine and threonine metabolism",Amino acid metabolism,Amino acid metabolism,hexachlorobenzene_impute,3.50643448230923e-5,4.20427802099038,0.249794647107893,0.132849688510068,0.366739605705719,positive,Amino acid metabolism,0.15010330732961752,343,,HCB,158.077141480817_115.4503113,158.077141480817,115.4503113,"Glycine, serine, alanine and threonine metabolism",Amino acid metabolism,Amino acid metabolism,0.0130029317966783,2.51892983091114,0.364747269367433,0.0782308366352722,0.651263702099594,positive,Amino acid metabolism,1,394,,Jointly Significant
158.076789401611_68.9497767318366,158.076789401611,68.9497767318366,CE2026,Amino Acid metab.,"Glycine, serine, alanine and threonine metabolism",Amino acid metabolism,Amino acid metabolism,hexachlorobenzene_impute,3.50643448230923e-5,4.20427802099038,0.249794647107893,0.132849688510068,0.366739605705719,positive,Amino acid metabolism,0.15010330732961752,343,,HCB,111.068308988435_116.4621895,111.068308988435,116.4621895,"Glycine, serine, alanine and threonine metabolism",Amino acid metabolism,Amino acid metabolism,0.0277269114788587,2.2265359995857,0.324195880186768,0.0360905282488536,0.612301232124682,positive,Amino acid metabolism,1,399,,Jointly Significant
157.079862586168_78.9833876774522,157.079862586168,78.9833876774522,C00135,Amino Acid metab.,Histidine metabolism,Amino acid metabolism,Amino acid metabolism,hexachlorobenzene_impute,1.91963931989396e-4,3.77853471389493,0.227444634082776,0.108965442252075,0.345923825913477,positive,Amino acid metabolism,0.25945139330203265,344,,HCB,157.08011621162_119.0810228,157.08011621162,119.0810228,Beta-Alanine metabolism; Histidine metabolism,Amino acid metabolism,Amino acid metabolism,0.00492132050056445,2.86186718360416,0.412503918200158,0.127302185896625,0.69770565050369,positive,Amino acid metabolism,1,389,,Jointly Significant
111.068433390786_77.2908475915227,111.068433390786,77.2908475915227,CE2026,Amino Acid metab.,"Glycine, serine, alanine and threonine metabolism",Amino acid metabolism,Amino acid metabolism,hexachlorobenzene_impute,2.42432849253526e-4,3.71707596802153,0.223955759447074,0.105365067573939,0.34254645132021,positive,Amino acid metabolism,0.25945139330203265,345,,HCB,158.077141480817_115.4503113,158.077141480817,115.4503113,"Glycine, serine, alanine and threonine metabolism",Amino acid metabolism,Amino acid metabolism,0.0130029317966783,2.51892983091114,0.364747269367433,0.0782308366352722,0.651263702099594,positive,Amino acid metabolism,1,394,,Jointly Significant
111.068433390786_77.2908475915227,111.068433390786,77.2908475915227,CE2026,Amino Acid metab.,"Glycine, serine, alanine and threonine metabolism",Amino acid metabolism,Amino acid metabolism,hexachlorobenzene_impute,2.42432849253526e-4,3.71707596802153,0.223955759447074,0.105365067573939,0.34254645132021,positive,Amino acid metabolism,0.25945139330203265,345,,HCB,111.068308988435_116.4621895,111.068308988435,116.4621895,"Glycine, serine, alanine and threonine metabolism",Amino acid metabolism,Amino acid metabolism,0.0277269114788587,2.2265359995857,0.324195880186768,0.0360905282488536,0.612301232124682,positive,Amino acid metabolism,1,399,,Jointly Significant
110.071389100622_77.9502705815515,110.071389100622,77.9502705815515,C00135; C01035,Amino Acid metab.,Histidine metabolism; Aspartate and asparagine metabolism,Amino acid metabolism,Amino acid metabolism,hexachlorobenzene_impute,3.65495047923302e-4,3.60696572718589,0.218239892255864,0.0991480736908217,0.337331710820907,positive,Amino acid metabolism,0.26687810466389267,346,,HCB,110.071265119234_119.5506625,110.071265119234,119.5506625,Beta-Alanine metabolism; Histidine metabolism; Aspartate and asparagine metabolism,Amino acid metabolism,Amino acid metabolism,0.0187099666292378,2.38160886333649,0.345209921586164,0.0584051404012204,0.632014702771107,positive,Amino acid metabolism,1,396,,Jointly Significant
110.071389100622_77.9502705815515,110.071389100622,77.9502705815515,C00135; C01035,Amino Acid metab.,Histidine metabolism; Aspartate and asparagine metabolism,Amino acid metabolism,Amino acid metabolism,hexachlorobenzene_impute,3.65495047923302e-4,3.60696572718589,0.218239892255864,0.0991480736908217,0.337331710820907,positive,Amino acid metabolism,0.26687810466389267,346,,HCB,128.081824482083_43.81513721,128.081824482083,43.81513721,Beta-Alanine metabolism; Histidine metabolism; Aspartate and asparagine metabolism,Amino acid metabolism,Amino acid metabolism,0.872423176865134,-0.160903378008931,-0.0239546839537158,-0.318531686890624,0.270622318983192,positive,Amino acid metabolism,1,515,,Sig. SOLAR only
175.085868550052_197.815135470731,175.085868550052,197.815135470731,C00643; C02693,Amino Acid metab.,Tryptophan metabolism,Amino acid metabolism,Amino acid metabolism,hexachlorobenzene_impute,0.00413740808088963,2.89078103647597,0.177426072721905,0.0566190873998183,0.298233058043992,positive,Amino acid metabolism,1,347,,HCB,175.086637973379_266.0715078,175.086637973379,266.0715078,Tryptophan metabolism,Amino acid metabolism,Amino acid metabolism,0.00725358009337613,2.72867455474962,0.392083224494345,0.107768026235545,0.676398422753144,positive,Amino acid metabolism,1,390,,Jointly Significant
152.022100259297_36.1398601456132,152.022100259297,36.1398601456132,C00791,Amino Acid metab.,Urea cycle/amino group metabolism,Amino acid metabolism,Amino acid metabolism,hexachlorobenzene_impute,0.00554575742049576,2.7947189534773,0.170701566618438,0.0504781209597729,0.290925012277103,positive,Amino acid metabolism,1,348,,HCB,152.022084545952_58.9850304,152.022084545952,58.9850304,Urea cycle/amino group metabolism,Amino acid metabolism,Amino acid metabolism,0.0436191143972269,-2.03791298785273,-0.273704864103186,-0.53945312680523,-0.00795660140114102,positive,Amino acid metabolism,1,405,,Jointly Significant
