metabolite_solar,mz_solar,rt_solar,cpd,aa_cho_lipid,pathways_solar,main_sp_pthw_solar,main_sp_pthw_categorized_solar,exposure,p_value_solar,t_score_solar,beta_solar,conf_low_solar,conf_high_solar,mode_solar,super_pathway_solar,q_value_solar,cpdnum_solar,cpd_sig_solar,exposure2,metabolite_chs,mz_chs,rt_chs,pathways_chs,main_sp_pthw_chs,main_sp_pthw_categorized_chs,p_value_chs,t_score_chs,beta_chs,conf_low_chs,conf_high_chs,mode_chs,super_pathway_chs,q_value_chs,cpdnum_chs,cpd_sig_chs,sig
112.087054027085_72.6915682749822,112.087054027085,72.6915682749822,C00135; C00388; C02679; C04518; C05138; C05485; C18038,Amino Acid & Lipid metab.,Histidine metabolism; Fatty Acid Metabolism; De novo fatty acid biosynthesis; C21-steroid hormone biosynthesis and metabolism,Amino acid metabolism; Lipid metabolism; Xenobiotics biodegradation and metabolism; Lipid metabolism; Steroid hormone metabolism,Amino acid metabolism; Other Combination of pathways; Lipid metabolism; Steroid hormone metabolism,hexachlorobenzene_impute,7.85700257847242e-4,3.39416447804439,0.207248573375635,0.0870640708941306,0.327433075857139,positive,Multiple/other,0.38654745436810234,1,,HCB,112.086910463458_115.2494923,112.086910463458,115.2494923,Beta-Alanine metabolism; Histidine metabolism; Histidine metabolism; Fatty Acid Metabolism; De novo fatty acid biosynthesis; C21-steroid hormone biosynthesis and metabolism,Amino acid metabolism; Lipid metabolism; Xenobiotics biodegradation and metabolism; Lipid metabolism; Steroid hormone metabolism,Amino acid metabolism; Other Combination of pathways; Lipid metabolism; Steroid hormone metabolism,0.068449636768745,1.83753767005738,0.268135545362124,-0.0205943109334663,0.556865401657714,positive,Multiple/other,1,40,,Sig. SOLAR only
156.076741862098_78.6779660521909,156.076741862098,78.6779660521909,C00135; C00881; C05504,Amino Acid & Lipid metab.,Histidine metabolism; Pyrimidine metabolism; C21-steroid hormone biosynthesis and metabolism,Amino acid metabolism; Nucleotide metabolism; Lipid metabolism; Steroid hormone metabolism,Amino acid metabolism; Nucleotide metabolism; Lipid metabolism; Steroid hormone metabolism,hexachlorobenzene_impute,8.1268228691451e-4,3.38453126718455,0.204328988183003,0.0855003122033158,0.32315766416269,positive,Multiple/other,0.38654745436810234,2,,HCB,156.07678474072_120.7419682,156.07678474072,120.7419682,Beta-Alanine metabolism; Histidine metabolism; Pyrimidine metabolism; C21-steroid hormone biosynthesis and metabolism,Amino acid metabolism; Nucleotide metabolism; Lipid metabolism; Steroid hormone metabolism,Amino acid metabolism; Nucleotide metabolism; Lipid metabolism; Steroid hormone metabolism,0.00995377797309847,2.6164534012022,0.376106060543695,0.0916790196863229,0.660533101401067,positive,Multiple/other,1,12,,Jointly Significant
95.0605132494523_77.4933265246021,95.0605132494523,77.4933265246021,C00153; C00388; C00785; C05828,Amino Acid metab.,Vitamin B3 (nicotinate and nicotinamide) metabolism; Histidine metabolism,Metabolism of cofactors and vitamins; Amino acid metabolism,Metabolism of cofactors and vitamins; Amino acid metabolism,hexachlorobenzene_impute,0.00155820267922426,3.1943318851245,0.19430910338051,0.07457912184748,0.31403908491354,positive,Multiple/other,0.667034780833546,3,,HCB,95.0603678462924_118.9844475,95.0603678462924,118.9844475,Vitamin B3 (nicotinate and nicotinamide) metabolism; Histidine metabolism,Metabolism of cofactors and vitamins; Amino acid metabolism,Metabolism of cofactors and vitamins; Amino acid metabolism,0.016757472919933,2.42378497076566,0.351992051846647,0.0646413087881355,0.639342794905158,positive,Multiple/other,1,18,,Jointly Significant
96.0445086317458_177.604756220539,96.0445086317458,177.604756220539,C00250; C00253; C00430; C00870; C01110; C01157; C01165; C03440; C03564; C03824; C10164,Other,"Vitamin B6 (pyridoxine) metabolism; Tryptophan metabolism; Glycine, serine, alanine and threonine metabolism; Arginine and Proline Metabolism; Urea cycle/amino group metabolism; Aspartate and asparagine metabolism; Parathio degradation; Arginine and Proline Metabolism; Urea cycle/amino group metabolism",NA,NA,hexachlorobenzene_impute,0.00559164246874843,2.79197983820353,0.169910769276748,0.0501268737827553,0.289694664770742,positive,Multiple/other,1,9,,HCB,96.0443459519664_54.53652793,96.0443459519664,54.53652793,"Vitamin B6 (pyridoxine) metabolism; Tryptophan metabolism; Urea cycle/amino group metabolism; Glycine, serine, alanine and threonine metabolism; Arginine and Proline Metabolism; Aspartate and asparagine metabolism; Xenobiotics metabolism; Urea cycle/amino group metabolism; Glutamate metabolism; Arginine and Proline Metabolism",NA,NA,0.403496067777079,0.838172852545643,0.121585165286462,-0.165440382718787,0.408610713291711,positive,Multiple/other,1,119,,Sig. SOLAR only
197.101007700031_66.8894381334852,197.101007700031,66.8894381334852,C00062; C00792; C16586; CE2173,Amino Acid metab.,"Glycine, serine, alanine and threonine metabolism; Arginine and Proline Metabolism; Alanine and Aspartate Metabolism; Urea cycle/amino group metabolism; Aspartate and asparagine metabolism; Tyrosine metabolism",Amino acid metabolism; Metabolism of cofactors and vitamins; Amino acid metabolism; Xenobiotics biodegradation and metabolism,Amino acid metabolism; Metabolism of cofactors and vitamins; Amino acid metabolism; Xenobiotics biodegradation and metabolism,hexachlorobenzene_impute,0.00695372299352308,2.71873199259433,0.157812050751362,0.04356011421028,0.272063987292444,positive,Multiple/other,1,11,,HCB,197.100913417232_114.5121263,197.100913417232,114.5121263,"Urea cycle/amino group metabolism; Glycine, serine, alanine and threonine metabolism; Arginine and Proline Metabolism; Aspartate and asparagine metabolism; Alanine and Aspartate Metabolism; Tyrosine metabolism",Amino acid metabolism; Metabolism of cofactors and vitamins; Amino acid metabolism; Xenobiotics biodegradation and metabolism,Amino acid metabolism; Metabolism of cofactors and vitamins; Other Combination of pathways,0.00781385782085997,-2.7025915262921,-0.384417578800111,-0.665864423407291,-0.102970734192931,positive,Multiple/other,1,11,,Jointly Significant
164.070076861411_230.200578208153,164.070076861411,230.200578208153,C00082; C01252; C05635; C05638; C16591; C16596; CE2174,Amino Acid metab.,Tyrosine metabolism; Tryptophan metabolism; Drug metabolism - cytochrome P450,Amino acid metabolism; Amino acid metabolism; Xenobiotics biodegradation and metabolism; Xenobiotics biodegradation and metabolism,Amino acid metabolism; Amino acid metabolism; Xenobiotics biodegradation and metabolism; Xenobiotics biodegradation and metabolism,hexachlorobenzene_impute,0.00912999506482653,2.62503180156143,0.161474136622763,0.040398097154652,0.282550176090875,positive,Multiple/other,1,14,,HCB,164.070616199054_270.5181398,164.070616199054,270.5181398,Tyrosine metabolism; Tryptophan metabolism; Drug metabolism - cytochrome P450,Amino acid metabolism; Other; Amino acid metabolism; Amino acid metabolism; Xenobiotics biodegradation and metabolism; Xenobiotics biodegradation and metabolism,Other Combination of pathways; Amino acid metabolism; Xenobiotics biodegradation and metabolism,0.76912731986641,-0.294140073459159,-0.0425465314683964,-0.328755685454729,0.243662622517936,positive,Multiple/other,1,191,,Sig. SOLAR only
132.06555571627_82.7832885321865,132.06555571627,82.7832885321865,C00430; C01042; C01045; C01110; C01157; C01165; C03341; C03440; C03564; C03912,Amino Acid metab.,"Glycine, serine, alanine and threonine metabolism; Arginine and Proline Metabolism; Urea cycle/amino group metabolism; Aspartate and asparagine metabolism; Alanine and Aspartate Metabolism; Arginine and Proline Metabolism; Urea cycle/amino group metabolism",Amino acid metabolism; Metabolism of cofactors and vitamins; Amino acid metabolism,Amino acid metabolism; Metabolism of cofactors and vitamins; Amino acid metabolism,hexachlorobenzene_impute,0.0212630338532377,2.31604282719245,0.131985733854317,0.0198174152534158,0.244154052455218,positive,Multiple/other,1,22,,HCB,132.065527857683_44.82589695,132.065527857683,44.82589695,"Urea cycle/amino group metabolism; Glycine, serine, alanine and threonine metabolism; Arginine and Proline Metabolism; Aspartate and asparagine metabolism; Alanine and Aspartate Metabolism; Urea cycle/amino group metabolism; Glutamate metabolism; Arginine and Proline Metabolism",Amino acid metabolism; Metabolism of cofactors and vitamins; Amino acid metabolism,Amino acid metabolism; Metabolism of cofactors and vitamins; Amino acid metabolism,0.418235378691715,-0.812111552040737,-0.119527924937853,-0.410751981807654,0.171696131931948,positive,Multiple/other,1,124,,Sig. SOLAR only
247.24188142712_21.2754679741912,247.24188142712,21.2754679741912,C00523; C00712; C03917; C04295; C04373; C05293; C05480; CE2209; CE2211,Lipid metab.,C21-steroid hormone biosynthesis and metabolism; De novo fatty acid biosynthesis; Fatty acid activation; Androgen and estrogen biosynthesis and metabolism,Lipid metabolism; Steroid hormone metabolism; Lipid metabolism; Steroid hormone metabolism,Lipid metabolism; Steroid hormone metabolism; Lipid metabolism; Steroid hormone metabolism,hexachlorobenzene_impute,0.0271416349743568,-2.2208911677364,-0.136239370233062,-0.256983257832792,-0.0154954826333317,positive,Multiple/other,1,24,,HCB,247.241980655317_35.98032119,247.241980655317,35.98032119,C21-steroid hormone biosynthesis and metabolism; De novo fatty acid biosynthesis; Fatty acid activation; Androgen and estrogen biosynthesis and metabolism,Lipid metabolism; Steroid hormone metabolism; Lipid metabolism; Steroid hormone metabolism,Lipid metabolism; Steroid hormone metabolism; Lipid metabolism; Steroid hormone metabolism,0.573088586107301,-0.564961789406151,-0.0821008853093766,-0.369643567936283,0.205441797317529,positive,Multiple/other,1,154,,Sig. SOLAR only
158.092373750873_73.327599283788,158.092373750873,73.327599283788,C00062; C00327; C00792,Amino Acid metab.,"Glycine, serine, alanine and threonine metabolism; Arginine and Proline Metabolism; Alanine and Aspartate Metabolism; Urea cycle/amino group metabolism; Aspartate and asparagine metabolism; Arginine and Proline Metabolism; Alanine and Aspartate Metabolism; Urea cycle/amino group metabolism; Aspartate and asparagine metabolism",Amino acid metabolism; Metabolism of cofactors and vitamins; Amino acid metabolism,Amino acid metabolism; Metabolism of cofactors and vitamins; Amino acid metabolism,hexachlorobenzene_impute,0.0324152687901645,2.14972915294025,0.129939437613195,0.0109668134133444,0.248912061813046,positive,Multiple/other,1,26,,HCB,158.092435284946_111.117412,158.092435284946,111.117412,"Urea cycle/amino group metabolism; Glycine, serine, alanine and threonine metabolism; Arginine and Proline Metabolism; Aspartate and asparagine metabolism; Alanine and Aspartate Metabolism; Urea cycle/amino group metabolism; Arginine and Proline Metabolism; Aspartate and asparagine metabolism; Alanine and Aspartate Metabolism",Amino acid metabolism; Metabolism of cofactors and vitamins; Amino acid metabolism,Amino acid metabolism; Metabolism of cofactors and vitamins; Amino acid metabolism,0.0881987745485702,-1.718086972849,-0.247487642034808,-0.532511968933311,0.0375366848636945,positive,Multiple/other,1,41,,Sig. SOLAR only
172.096838237607_202.899362932119,172.096838237607,202.899362932119,C02727; C03758,Amino Acid & CHO metab.,Butanoate metabolism; Tyrosine metabolism,Carbohydrate metabolism; Amino acid metabolism,Carbohydrate metabolism; Amino acid metabolism,hexachlorobenzene_impute,0.0357061751333832,2.11023774607951,0.128482447404064,0.00864233217891175,0.248322562629217,positive,Multiple/other,1,27,,HCB,172.096779766118_42.29823454,172.096779766118,42.29823454,Butanoate metabolism; Tyrosine metabolism,Carbohydrate metabolism; Amino acid metabolism,Carbohydrate metabolism; Amino acid metabolism,0.420047722549046,0.808945253376335,0.112940774079184,-0.163311069288314,0.389192617446681,positive,Multiple/other,1,127,,Sig. SOLAR only
245.226216601157_24.2711648854844,245.226216601157,24.2711648854844,C00523; C00535; C00674; C01227; C01595; C01953; C03681; C03772; C03917; C04042; C04295; C04373; C05293; dhea,Lipid metab.,C21-steroid hormone biosynthesis and metabolism; Linoleate metabolism; Glycerophospholipid metabolism; Fatty Acid Metabolism; De novo fatty acid biosynthesis; Fatty acid activation,Lipid metabolism; Steroid hormone metabolism; Lipid metabolism,Lipid metabolism; Steroid hormone metabolism; Lipid metabolism,hexachlorobenzene_impute,0.0415178171298433,2.04754629301422,0.105077042682803,0.00406714849913667,0.206086936866468,positive,Multiple/other,1,30,,HCB,245.226307211085_35.34415477,245.226307211085,35.34415477,C21-steroid hormone biosynthesis and metabolism; Linoleate metabolism; Fatty Acid Metabolism; De novo fatty acid biosynthesis; Fatty acid activation; Glycerophospholipid metabolism,Lipid metabolism; Steroid hormone metabolism; Lipid metabolism,Lipid metabolism; Steroid hormone metabolism; Lipid metabolism,0.669098131238558,0.428374957755157,0.0636705040153406,-0.230424582564496,0.357765590595177,positive,Multiple/other,1,179,,Sig. SOLAR only
99.0441270506069_272.611640777482,99.0441270506069,272.611640777482,C00148; C00763; C01801; C05576; CE4788,Amino Acid & Lipid metab.,Arginine and Proline Metabolism; Urea cycle/amino group metabolism; Aspartate and asparagine metabolism; Glycerophospholipid metabolism; Tyrosine metabolism,Amino acid metabolism; Lipid metabolism; Nucleotide metabolism,Amino acid metabolism; Other Combination of pathways,hexachlorobenzene_impute,0.0417717114811384,2.04498242786846,0.127414736200669,0.00477819787899346,0.250051274522344,positive,Multiple/other,1,31,,HCB,99.0440354718824_36.85008998,99.0440354718824,36.85008998,Urea cycle/amino group metabolism; Arginine and Proline Metabolism; Aspartate and asparagine metabolism; Glycerophospholipid metabolism; Tyrosine metabolism,Amino acid metabolism; Lipid metabolism; Nucleotide metabolism,Amino acid metabolism; Other Combination of pathways,0.00767757617954123,2.70877591401697,0.386966640465596,0.104300360325248,0.669632920605943,positive,Multiple/other,1,10,,Jointly Significant
119.085481046417_22.0857337478823,119.085481046417,22.0857337478823,CE2577; CE4989; CE5828; CE5924; CE5929; CE5931; CE6234,Lipid metab.,Linoleate metabolism; Prostaglandin formation from arachidonate; Leukotriene metabolism,Lipid metabolism; Lipid metabolism; NA,Lipid metabolism; Lipid metabolism; NA,hexachlorobenzene_impute,0.0426594990451519,-2.03612040778054,-0.122775456412052,-0.241461022276371,-0.00408989054773351,positive,Multiple/other,1,32,,HCB,119.085544953088_36.04141854,119.085544953088,36.04141854,Linoleate metabolism; Prostaglandin formation from arachidonate; Leukotriene metabolism,Lipid metabolism; Lipid metabolism; NA,Lipid metabolism; Lipid metabolism; NA,0.4209825190298,0.807315270184753,0.114301796421974,-0.165843570594928,0.394447163438875,positive,Multiple/other,1,128,,Sig. SOLAR only
120.065592968572_63.5501002766406,120.065592968572,63.5501002766406,C00025; C00188; C00217; C05519; C05938,"Amino Acid, Lipid, & CHO metab.","Methionine and cysteine metabolism; Glycine, serine, alanine and threonine metabolism; Arginine and Proline Metabolism; Tryptophan metabolism; Alanine and Aspartate Metabolism; Urea cycle/amino group metabolism; Histidine metabolism; Tyrosine metabolism; Aspartate and asparagine metabolism; Glycine, serine, alanine and threonine metabolism",Amino acid metabolism; Carbohydrate metabolism; Lipid metabolism; Metabolism of cofactors and vitamins; Nucleotide metabolism; Amino acid metabolism,Other Combination of pathways; Amino acid metabolism,hexachlorobenzene_impute,0.0509745486061722,1.9599324711899,0.118083593534142,-5.03727266300491e-4,0.236670914334585,positive,Multiple/other,1,36,,HCB,120.06551381768_93.86865768,120.06551381768,93.86865768,"Tyrosine metabolism; Urea cycle/amino group metabolism; Tryptophan metabolism; Valine, leucine and isoleucine degradation; Glycine, serine, alanine and threonine metabolism; Glutathione Metabolism; Glutamate metabolism; Beta-Alanine metabolism; Arginine and Proline Metabolism; Histidine metabolism; Lysine metabolism; Aspartate and asparagine metabolism; Methionine and cysteine metabolism; Aminosugars metabolism; Alanine and Aspartate Metabolism; Glycine, serine, alanine and threonine metabolism",Amino acid metabolism; Carbohydrate metabolism; Energy metabolism; Lipid metabolism; Metabolism of cofactors and vitamins; Nucleotide metabolism; Amino acid metabolism,Other Combination of pathways; Amino acid metabolism,0.316856614039151,1.00486727104116,0.148653261816266,-0.144057909465485,0.441364433098017,positive,Multiple/other,1,99,,Not-sig
116.106993530236_47.5727142560677,116.106993530236,47.5727142560677,C03087,CHO metab.,Butanoate metabolism,Carbohydrate metabolism,Carbohydrate metabolism,hexachlorobenzene_impute,0.060063823578477,1.88780906300751,0.115223909978937,-0.00491241593373129,0.235360235891606,positive,Multiple/other,1,41,,HCB,132.101939167514_58.02844945,132.101939167514,58.02844945,Butanoate metabolism,Carbohydrate metabolism,Carbohydrate metabolism,0.0018851777546394,3.17369315913455,0.414832118338687,0.156200871089483,0.673463365587891,positive,Multiple/other,0.5969244282542112,7,,Sig. CHS only
116.106993530236_47.5727142560677,116.106993530236,47.5727142560677,C03087,CHO metab.,Butanoate metabolism,Carbohydrate metabolism,Carbohydrate metabolism,hexachlorobenzene_impute,0.060063823578477,1.88780906300751,0.115223909978937,-0.00491241593373129,0.235360235891606,positive,Multiple/other,1,41,,HCB,116.106976548875_62.08366235,116.106976548875,62.08366235,Butanoate metabolism,Carbohydrate metabolism,Carbohydrate metabolism,0.826629184271174,0.219475614401582,0.0324734971489014,-0.260289607198785,0.325236601496588,positive,Multiple/other,1,205,,Not-sig
327.252811938185_21.9457663952776,327.252811938185,21.9457663952776,C00639; C04741; C04843; C05959; C05963; C14782; C14814,Lipid metab.,Prostaglandin formation from arachidonate; Arachidonic acid metabolism; Prostaglandin formation from arachidonate,Lipid metabolism; NA; Lipid metabolism,Lipid metabolism; NA; Lipid metabolism,hexachlorobenzene_impute,0.0858686338777702,-1.72355664299423,-0.1027725068398,-0.220138206922539,0.0145931932429394,positive,Multiple/other,1,55,,HCB,327.252838958243_36.19152097,327.252838958243,36.19152097,Arachidonic acid metabolism; Prostaglandin formation from arachidonate; Prostaglandin formation from arachidonate,Lipid metabolism; NA; Lipid metabolism,Lipid metabolism; NA; Lipid metabolism,0.132058589582269,-1.51570911413872,-0.211980394341347,-0.488708575961268,0.0647477872785736,positive,Multiple/other,1,53,,Not-sig
167.070213260767_32.0207287257868,167.070213260767,32.0207287257868,C00588; C00788; C05581; C05589; C05594,Amino Acid & Lipid metab.,Tyrosine metabolism; Urea cycle/amino group metabolism; Tyrosine metabolism,Amino acid metabolism; Lipid metabolism; Amino acid metabolism,Other Combination of pathways; Amino acid metabolism,hexachlorobenzene_impute,0.086508235317435,-1.72003273963581,-0.105295536554708,-0.22578887928712,0.0151978061777046,positive,Multiple/other,1,56,,HCB,167.070307408971_37.98690344,167.070307408971,37.98690344,Tyrosine metabolism; Tyrosine metabolism; Urea cycle/amino group metabolism,Amino acid metabolism; Lipid metabolism; Amino acid metabolism,Other Combination of pathways; Amino acid metabolism,0.997590157467251,0.00302619907773184,4.43817241087935e-4,-0.289744704742845,0.29063233922502,positive,Multiple/other,1,230,,Not-sig
130.049936535741_65.3429357547741,130.049936535741,65.3429357547741,C00025; C00064; C00217; C00819; C01042; C01045; C01879; C02220; C02238; C04281; C04282; C05100; C05938; CE1554,"Amino Acid, Lipid, & CHO metab.","Methionine and cysteine metabolism; Glycine, serine, alanine and threonine metabolism; Arginine and Proline Metabolism; Tryptophan metabolism; Alanine and Aspartate Metabolism; Urea cycle/amino group metabolism; Histidine metabolism; Tyrosine metabolism; Aspartate and asparagine metabolism; Arginine and Proline Metabolism; Alanine and Aspartate Metabolism; Tyrosine metabolism; Aspartate and asparagine metabolism; Alanine and Aspartate Metabolism; Arginine and Proline Metabolism; Aspartate and asparagine metabolism; Tryptophan metabolism; Glycine, serine, alanine and threonine metabolism",Amino acid metabolism; Carbohydrate metabolism; Lipid metabolism; Metabolism of cofactors and vitamins; Nucleotide metabolism; Amino acid metabolism; Metabolism of cofactors and vitamins; Nucleotide metabolism; Amino acid metabolism; Metabolism of cofactors and vitamins; Amino acid metabolism,Other Combination of pathways; Amino acid metabolism; Metabolism of cofactors and vitamins; Amino acid metabolism,hexachlorobenzene_impute,0.106189555774413,1.6206739934075,0.0985318721544355,-0.0211341557925894,0.21819790010146,positive,Multiple/other,1,67,,HCB,130.049874013457_106.0217565,130.04987401345701,106.0217565,"Tyrosine metabolism; Urea cycle/amino group metabolism; Tryptophan metabolism; Valine, leucine and isoleucine degradation; Glycine, serine, alanine and threonine metabolism; Glutathione Metabolism; Glutamate metabolism; Beta-Alanine metabolism; Arginine and Proline Metabolism; Histidine metabolism; Lysine metabolism; Aspartate and asparagine metabolism; Methionine and cysteine metabolism; Aminosugars metabolism; Alanine and Aspartate Metabolism; Tyrosine metabolism; Glutamate metabolism; Arginine and Proline Metabolism; Aspartate and asparagine metabolism; Aminosugars metabolism; Alanine and Aspartate Metabolism; Alanine and Aspartate Metabolism; Glutathione Metabolism; Arginine and Proline Metabolism; Aspartate and asparagine metabolism; Tryptophan metabolism; Glycine, serine, alanine and threonine metabolism",Amino acid metabolism; Carbohydrate metabolism; Energy metabolism; Lipid metabolism; Metabolism of cofactors and vitamins; Nucleotide metabolism; Amino acid metabolism; Carbohydrate metabolism; Energy metabolism; Metabolism of cofactors and vitamins; Nucleotide metabolism; Amino acid metabolism; Metabolism of cofactors and vitamins; Amino acid metabolism,Other Combination of pathways; Amino acid metabolism; Metabolism of cofactors and vitamins; Amino acid metabolism,0.246330893466334,-1.16463966122932,-0.163724036172474,-0.441883872709658,0.114435800364709,positive,Multiple/other,1,82,,Not-sig
102.055072540213_74.1441432745719,102.055072540213,74.1441432745719,C00025; C00188; C00217; C00940; C01250; C01879; C04281; C04282; C05519; C05938,"Amino Acid, Lipid, & CHO metab.","Methionine and cysteine metabolism; Glycine, serine, alanine and threonine metabolism; Arginine and Proline Metabolism; Tryptophan metabolism; Alanine and Aspartate Metabolism; Urea cycle/amino group metabolism; Histidine metabolism; Tyrosine metabolism; Aspartate and asparagine metabolism; Glycine, serine, alanine and threonine metabolism; Alanine and Aspartate Metabolism; Urea cycle/amino group metabolism; Arginine and Proline Metabolism; Aspartate and asparagine metabolism",Amino acid metabolism; Carbohydrate metabolism; Lipid metabolism; Metabolism of cofactors and vitamins; Nucleotide metabolism; Amino acid metabolism,Other Combination of pathways; Amino acid metabolism,hexachlorobenzene_impute,0.127428786206737,1.52876155460258,0.0928157612887617,-0.0266853056859895,0.212316828263513,positive,Multiple/other,1,78,,HCB,102.054941254827_129.5664869,102.054941254827,129.5664869,"Tyrosine metabolism; Urea cycle/amino group metabolism; Tryptophan metabolism; Valine, leucine and isoleucine degradation; Glycine, serine, alanine and threonine metabolism; Glutathione Metabolism; Glutamate metabolism; Beta-Alanine metabolism; Arginine and Proline Metabolism; Histidine metabolism; Lysine metabolism; Aspartate and asparagine metabolism; Methionine and cysteine metabolism; Aminosugars metabolism; Alanine and Aspartate Metabolism; Glycine, serine, alanine and threonine metabolism; Alanine and Aspartate Metabolism; Urea cycle/amino group metabolism; Glutathione Metabolism; Arginine and Proline Metabolism; Aspartate and asparagine metabolism",Amino acid metabolism; Carbohydrate metabolism; Energy metabolism; Lipid metabolism; Metabolism of cofactors and vitamins; Nucleotide metabolism; Amino acid metabolism,Other Combination of pathways; Amino acid metabolism,0.438531930496962,0.777102793298542,0.112187125113273,-0.173465424463218,0.397839674689763,positive,Multiple/other,1,131,,Not-sig
169.035834820541_53.3002903402657,169.035834820541,53.3002903402657,C00366,Nucleotide metab.,Purine metabolism,Nucleotide metabolism,Nucleotide metabolism,hexachlorobenzene_impute,0.13297064318538,-1.50678050825673,-0.0926276566180316,-0.213626296281378,0.0283709830453147,positive,Multiple/other,1,79,,HCB,169.035652339614_71.19523953,169.035652339614,71.19523953,Purine metabolism,Nucleotide metabolism,Nucleotide metabolism,0.20199936515626,1.28245888651937,0.157824725967651,-0.0856787406451301,0.401328192580433,positive,Nucleotide metabolism,1,584,,Not-sig
